,Protein IDs,Fasta headers,diff,Intensity Pynd_AlkKO_WCL,Intensity Control_WCL
1280,['YHL004W'],"['>YHL004W MRP4 SGDID:S000000996, Chr VIII from 99219-100403, Genome Release 64-2-1, Verified ORF, Mitochondrial ribosomal protein of the small subunit']",-1.0536339549856422,20.003056674908358,21.056690629894
1083,['YGL123W'],"['>YGL123W RPS2 SGDID:S000003091, Chr VII from 277617-278381, Genome Release 64-2-1, Verified ORF, Protein component of the small (40S) subunit', 'essential for control of translational accuracy', 'phosphorylation by C-terminal domain kinase I (CTDK-I) enhances']",-1.0505887451776807,29.989830941186646,31.040419686364327
1837,['YLL001W'],"['>YLL001W DNM1 SGDID:S000003924, Chr XII from 147890-150163, Genome Release 64-2-1, Verified ORF, Dynamin-related GTPase involved in mitochondrial organization', 'required for mitochondrial fission and morphology', 'assembles on the cytoplasmic face of mitocho']",-1.042402541413935,23.082306947055116,24.12470948846905
2299,"['YNL009W', 'YLR174W']","['>YNL009W IDP3 SGDID:S000004954, Chr XIV from 614821-616083, Genome Release 64-2-1, Verified ORF, Peroxisomal NADP-dependent isocitrate dehydrogenase', 'catalyzes oxidation of isocitrate to alpha-ketoglutarate with the formation of NADP(H+), required for gro']",-1.0397177168467238,22.524468064884093,23.564185781730817
1736,['YKL127W'],"['>YKL127W PGM1 SGDID:S000001610, Chr XI from 203541-205253, Genome Release 64-2-1, Verified ORF, Phosphoglucomutase, minor isoform', 'catalyzes the conversion from glucose-1-phosphate to glucose-6-phosphate, which is a key step in hexose metabolism', 'PGM1 has']",-1.0382685959618527,22.18981611521393,23.228084711175782
758,['YDR390C'],"['>YDR390C UBA2 SGDID:S000002798, Chr IV from 1256847-1254937, Genome Release 64-2-1, reverse complement, Verified ORF, Subunit of heterodimeric nuclear SUMO activating enzyme E1 with Aos1p', 'activates Smt3p (SUMO) before its conjugation to proteins (sumoyla']",-1.0334347248656357,20.841380068032514,21.87481479289815
456,['YDL029W'],"['>YDL029W ARP2 SGDID:S000002187, Chr IV from 399340-399361,399485-400638, Genome Release 64-2-1, Verified ORF, Essential component of the Arp2/3 complex', 'Arp2/3 is a highly conserved actin nucleation center required for the motility and integrity of actin']",-1.0323747963726007,25.247497021905414,26.279871818278014
1920,['YLR133W'],"['>YLR133W CKI1 SGDID:S000004123, Chr XII from 408445-410193, Genome Release 64-2-1, Verified ORF, Choline kinase', 'catalyzes the first step in phosphatidylcholine synthesis via the CDP-choline (Kennedy pathway)', 'exhibits some ethanolamine kinase activity co']",-1.0322289244398561,21.261725368124132,22.29395429256399
144,['YAL025C'],"['>YAL025C MAK16 SGDID:S000000023, Chr I from 101145-100225, Genome Release 64-2-1, reverse complement, Verified ORF, Essential nuclear protein', 'constituent of 66S pre-ribosomal particles', 'required for maturation of 25S and 5.8S rRNAs', 'required for maintena']",-1.030760481004485,20.71137458204485,21.742135063049336
977,['YFL016C'],"['>YFL016C MDJ1 SGDID:S000001878, Chr VI from 106236-104701, Genome Release 64-2-1, reverse complement, Verified ORF, Co-chaperone that stimulates HSP70 protein Ssc1p ATPase activity', 'involved in protein folding/refolding in the mitochodrial matrix', 'require']",-1.0304494427360886,21.445109846252937,22.475559288989025
2346,['YNL098C'],"['>YNL098C RAS2 SGDID:S000005042, Chr XIV from 440570-439602, Genome Release 64-2-1, reverse complement, Verified ORF, GTP-binding protein', 'regulates nitrogen starvation response, sporulation, and filamentous growth', 'farnesylation and palmitoylation require']",-1.0304268962751628,24.7064083291515,25.736835225426663
427,['YCR051W'],"['>YCR051W YCR051W SGDID:S000000647, Chr III from 214071-214739, Genome Release 64-2-1, Uncharacterized ORF, Putative protein of unknown function', 'green fluorescent protein (GFP)-fusion protein localizes to the cytoplasm and nucleus', 'contains ankyrin (Ank)']",-1.025919303417524,23.782067983082293,24.807987286499817
440,['YCR084C'],"['>YCR084C TUP1 SGDID:S000000680, Chr III from 262452-260311, Genome Release 64-2-1, reverse complement, Verified ORF, General repressor of transcription', 'forms complex with Cyc8p, involved in the establishment of repressive chromatin structure through inte']",-1.0176572375493684,25.228172808413106,26.245830045962474
769,"['YEL054C', 'YDR418W']","['>YEL054C RPL12A SGDID:S000000780, Chr V from 53218-52721, Genome Release 64-2-1, reverse complement, Verified ORF, Ribosomal 60S subunit protein L12A', 'rpl12a rpl12b double mutant exhibits slow growth and slow translation', 'homologous to mammalian ribosomal']",-1.0119263156664537,29.869104233017875,30.88103054868433
890,['YER049W'],"['>YER049W TPA1 SGDID:S000000851, Chr V from 251728-253662, Genome Release 64-2-1, Verified ORF, Fe(II)/2-oxoglutarate-dependent dioxygenase family member', 'catalyzes the repair of methyl-base lesions in both ss and dsDNA by oxidative demethylation', 'Poly(rA)']",-1.0119072706480274,23.90297416974327,24.914881440391298
2238,['YMR203W'],"['>YMR203W TOM40 SGDID:S000004816, Chr XIII from 668492-669655, Genome Release 64-2-1, Verified ORF, Component of the TOM (translocase of outer membrane) complex', 'responsible for recognition and initial import steps for all mitochondrially directed proteins']",-1.0118209926373858,23.73034491623308,24.742165908870465
2880,['YPL262W'],"['>YPL262W FUM1 SGDID:S000006183, Chr XVI from 47336-48802, Genome Release 64-2-1, Verified ORF, Fumarase', 'converts fumaric acid to L-malic acid in the TCA cycle', 'cytosolic and mitochondrial distribution determined by the N-terminal targeting sequence, prot']",-1.0103307574777922,25.45697975292149,26.467310510399283
2316,['YNL050C'],"['>YNL050C YNL050C SGDID:S000004995, Chr XIV from 534874-534079,534982-534966, Genome Release 64-2-1, reverse complement, Uncharacterized ORF, Putative protein of unknown function', 'YNL050c is not an essential gene']",-1.0097040928028882,24.494299442503618,25.504003535306506
1563,['YJL123C'],"['>YJL123C MTC1 SGDID:S000003659, Chr X from 189440-188004, Genome Release 64-2-1, reverse complement, Verified ORF, Protein of unknown function that may interact with ribosomes', 'green fluorescent protein (GFP)-fusion protein localizes to the cytoplasm and']",-1.0090200598123538,24.128175613418996,25.13719567323135
2564,['YOL142W'],"['>YOL142W RRP40 SGDID:S000005502, Chr XV from 55558-56280, Genome Release 64-2-1, Verified ORF, Exosome non-catalytic core component', 'involved in 3-5 RNA processing and degradation in both the nucleus and the cytoplasm', 'predicted to contain both S1 and K']",-1.0075125487328869,22.247714311617532,23.25522686035042
711,['YDR298C'],"['>YDR298C ATP5 SGDID:S000002706, Chr IV from 1058814-1058176, Genome Release 64-2-1, reverse complement, Verified ORF, Subunit 5 of the stator stalk of mitochondrial F1F0 ATP synthase', 'F1F0 ATP synthase is a large, evolutionarily conserved enzyme complex r']",-1.0050962098776601,25.222103559842296,26.227199769719956
1450,['YIL105C'],"['>YIL105C SLM1 SGDID:S000001367, Chr IX from 169641-167581, Genome Release 64-2-1, reverse complement, Verified ORF, Phosphoinositide PI4,5P(2) binding protein, forms a complex with Slm2p', 'acts downstream of Mss4p in a pathway regulating actin cytoskeleton']",-1.0047184386713148,20.027020450409836,21.03173888908115
986,['YFL034C-A'],"['>YFL034C-A RPL22B SGDID:S000006436, Chr VI from 64599-64243,64932-64921, Genome Release 64-2-1, reverse complement, Verified ORF, Ribosomal 60S subunit protein L22B', 'homologous to mammalian ribosomal protein L22, no bacterial homolog', 'RPL22B has a paralog']",-1.0032675138084066,22.95996090982382,23.963228423632227
2833,['YPL169C'],"['>YPL169C MEX67 SGDID:S000006090, Chr XVI from 230838-229039, Genome Release 64-2-1, reverse complement, Verified ORF, Poly(A)RNA binding protein involved in nuclear mRNA export', 'component of the nuclear pore', 'ortholog of human TAP']",-1.0014613745284144,20.875752350633277,21.877213725161692
